{
  "profile": {
    "name": "Quentin F. Davis",
    "roles": [
      "Developer",
      "AI Engineer",
      "Game Developer",
      "Artist"
    ],
    "tagline": "I build gameplay systems, AI companions, and production software, then draw the worlds they live in.",
    "backgroundVideo": "video/HomePlaceholderVid.mp4",
    "backgroundVideoRotate": 0,
    "about": [
      "I am a software engineer who works in C++ first and has spent the last several years building things that have to run, not just demo. Two of my systems are deployed and in daily use: SyncBridge, an Azure-backed orchestration service that keeps five meeting and recording platforms in sync, and WorkingDoc Automation, a FastAPI app that imports, merges, and reconciles authorization records without destroying the manual corrections people have already made.",
      "The other half of my work is real-time. Project Hunter is an Unreal Engine 5 action RPG built on the Gameplay Ability System, where character capability lives in components rather than one enormous pawn so combat, stats, and traversal can be iterated separately. REVIA is a local-first desktop AI companion I originally prototyped in Python and then rewrote in C++ with Qt 6, running llama.cpp and whisper.cpp on the user's own hardware with SQLite-backed memory. Rewriting it taught me more about latency, threading, and lifetime management than any tutorial project would have.",
      "I have also been drawing for seventeen years, which is not a side note. Character sheets, background paintings, and colour work are how I learned composition, readability, and what a player's eye actually does with a frame. It is the reason I care about UI hierarchy in UMG and Qt as much as I care about the systems underneath, and why I am most useful on teams where gameplay code and presentation are not separate conversations."
    ],
    "disciplines": [
      {
        "theme": "apps",
        "title": "Apps",
        "blurb": "Deployed cloud tools and internal consoles that carry real operational load.",
        "href": "#projects.html?category=Apps"
      },
      {
        "theme": "ai",
        "title": "AI",
        "blurb": "Local inference, persistent memory, and voice systems that run on your own hardware.",
        "href": "#projects.html?category=AI"
      },
      {
        "theme": "games",
        "title": "Games",
        "blurb": "Modular gameplay architecture in Unreal Engine and hand-built interactive stories.",
        "href": "#projects.html?category=Games"
      },
      {
        "theme": "art",
        "title": "Art",
        "blurb": "Character design, background painting, and colour work for interactive scenes.",
        "href": "#art.html"
      }
    ]
  },
  "filters": {
    "projects": ["Apps", "AI", "Games", "Web"],
    "art": ["Character Art", "Environment Art", "Visual Novel Scene", "Colorist", "Cover Art", "Digital Art"]
  },
  "contact": {
    "email": "dev.quentindavis@gmail.com",
    "location": "United States | Open to Remote Work",
    "availability": "Open to game development, software, and interactive media roles.",
    "githubUrl": "https://github.com/MahouSenseii",
    "linkedinUrl": "https://www.linkedin.com/in/quentin-f-davis"
  },
  "resume": {
    "url": "documents/quentin_davis_resume.docx",
    "updated": "August 2026",
    "role": "C++ Gameplay & Systems Developer",
    "summary": "C++ developer with production experience across Unreal Engine gameplay systems, local AI desktop applications, and deployed cloud services. Comfortable owning a system from architecture through deployment, and equally comfortable working next to designers and artists on how it should feel.",
    "technicalSkills": [
      "C++",
      "Unreal Engine 5",
      "Gameplay Ability System",
      "Blueprint/C++ Integration",
      "Qt 6",
      "Python",
      "FastAPI",
      "TypeScript",
      "React",
      "Azure",
      "SQL & SQLite",
      "llama.cpp",
      "Docker",
      "CMake",
      "Git"
    ],
    "strengths": [
      "Gameplay and systems architecture in C++, with a bias toward modular, component-driven design",
      "Taking a system all the way to deployment and then keeping it running",
      "Working across engineering and art, and translating between the two",
      "Debugging, profiling, and reducing complexity in code that already exists"
    ],
    "experience": [
      {
        "title": "Programmer",
        "organization": "Kukua Institute",
        "location": "Remote",
        "timeframe": "Present",
        "highlights": [
          "Develop and maintain software systems that support organizational technical infrastructure and workflow tooling.",
          "Collaborate cross-functionally to architect and deliver scalable solutions."
        ]
      },
      {
        "title": "Junior Programmer",
        "organization": "AI for Better Lives",
        "location": "Remote",
        "timeframe": "Jan 2020 - 2026",
        "highlights": [
          "Designed and implemented low-level systems supporting higher-level pipelines.",
          "Built and maintained a WinForms knowledge representation tool for AI-backed database workflows."
        ]
      },
      {
        "title": "Independent Software & Game Developer",
        "organization": "Self-directed",
        "location": "Remote",
        "timeframe": "Mar 2018 - Present",
        "highlights": [
          "Architected GAS gameplay systems in Unreal Engine 5, including socket-based swept-volume damage traces and equipment interfaces.",
          "Built modular C++ UI systems for inventory, equipment, and interaction workflows.",
          "Rewrote a Python AI assistant prototype into a C++/Qt 6 desktop application running llama.cpp and whisper.cpp locally with SQLite-backed memory.",
          "Delivered and deployed two Azure-hosted production services: a five-platform sync orchestration console and an authorization reconciliation web app.",
          "Designed, built, and launched a client business services site, handed over for the client to maintain themselves."
        ]
      }
    ],
    "education": [
      "Bachelor of Science in Computer Science, completed May 2025.",
      "Associate in Computer Science, Pensacola State College."
    ]
  },
  "projects": [
    {
      "name": "Project Hunter",
      "categories": ["Games"],
      "theme": "games",
      "status": ["In Development"],
      "devlog": [],
      "platform": "PC - Windows",
      "subtitle": "Action RPG prototype built in Unreal Engine 5",
      "role": "Gameplay Programmer / Systems Designer",
      "timeframe": "Jan 2023 - Present",
      "engine": "Unreal Engine 5",
      "image": "img/projects/PH-thumbnail.webp",
      "thumbnail": "img/projects/thumbs/PH-thumbnail.webp",
      "heroImage": "img/projects/project-hunter-character.webp",
      "heroAlt": "Project Hunter protagonist character render",
      "heroStyle": "cutout",
      "characterImage": "img/projects/project-hunter-character.webp",
      "characterAlt": "Blue-haired Project Hunter protagonist holding a sword",
      "imageAlt": "Project Hunter Unreal Engine gameplay debug view showing character state and resource effects",
      "summary": "A modular action RPG prototype built in UE5 around survival horror pacing, component-driven character systems, and resource-aware player pressure.",
      "details": "Built around modular gameplay logic, enemy pressure, and a player experience that rewards careful movement and resource awareness.",
      "highlights": [
        "Custom gameplay systems built from ALS",
        "GAS-integrated stats and combat",
        "Component-driven character systems",
        "Prototype-focused iteration"
      ],
      "tags": ["Unreal Engine 5", "C++", "Gameplay Ability System", "Action RPG", "Blueprints"],
      "featured": true,
      "sortOrder": 1,
      "galleryImages": [],
      "videoUrl": "",
      "links": [
        {
          "label": "View Source",
          "url": "https://github.com/MahouSenseii/ProjectHunter"
        }
      ],
      "detail": {
        "overview": "Project Hunter is a long-running Unreal Engine 5 prototype exploring how far modular, component-driven architecture can carry an action RPG. Survival horror pacing sets the tone: movement costs something, resources run out, and enemy pressure is meant to be read rather than out-clicked.",
        "sections": [
          {
            "title": "Gameplay Systems",
            "body": "Character capability is split across components rather than a monolithic pawn, so stats, combat, and traversal can be iterated independently.",
            "items": [
              "Custom gameplay systems built on top of ALS",
              "GAS-integrated stats and combat resolution",
              "Socket-based swept-volume damage traces",
              "Modular C++ inventory, equipment, and interaction systems"
            ]
          },
          {
            "title": "Technical Direction",
            "body": "Blueprint and C++ share the workload deliberately: systems and data live in C++, while designer-facing tuning stays in Blueprint. The project is roughly 2.5 MB of C++ across 219 commits and is currently mid-refactor as the core architecture settles.",
            "items": []
          }
        ],
        "roadmap": {
          "implemented": [
            "Custom gameplay systems built on top of ALS",
            "GAS-integrated stats and combat",
            "Component-driven character systems",
            "Modular C++ UI for inventory and equipment"
          ],
          "inProgress": [
            "Architecture refactor of core gameplay modules"
          ],
          "planned": []
        }
      }
    },
    {
      "name": "R.E.V.I.A",
      "demoRoute": "#revia.html",
      "categories": ["AI", "Apps"],
      "theme": "ai",
      "status": ["In Development", "Migrated to C++"],
      "devlog": [],
      "platform": "Windows 10+ desktop",